{
  "api_version": "celld-fleet.agentic-sandbox/v1",
  "fleet_id": "celld-poc",
  "trust_domain": "celld-poc.internal",
  "celld": {
    "version": "v0.2.1",
    "artifact": "https://github.com/denoland/celld/archive/ae8fac053d79f971bfcb996054bb43eb2f9b05da.tar.gz",
    "digest": "sha256:69554171c3b927d32b6d334475071d4b5fa7abd1a2bdd11cac78a6858a5b2923",
    "protocol_version": "celld-internal-v1"
  },
  "application_bundle": "sha256:9057aa0debb402c9f8177d1df0c8c06de487c266029f0c5282a8e1cd1076322b",
  "nodes": {
    "count": 3,
    "substrate": "qemu",
    "architecture": "x86_64",
    "reserve": 1
  },
  "storage": {
    "provider": "aws-s3",
    "bucket": "replace-with-dedicated-celld-bucket",
    "prefix": "celld-poc/cells",
    "region": "us-east-1",
    "credential_ref": "broker://celld/celld-poc/object-store-admin",
    "retain_on_destroy": true
  },
  "network": {
    "public_listener": "0.0.0.0:443",
    "internal_listener": "10.88.0.10:8124",
    "advertised_addresses": ["10.88.0.10:8124", "10.88.0.11:8124", "10.88.0.12:8124"],
    "encrypted_overlay": true,
    "public_ingress_excludes_internal": true
  },
  "resources": {
    "cpu_cores": 2,
    "memory_mb": 2048,
    "max_resident_cells": 1000,
    "max_rss_mb": 1536
  },
  "telemetry": {
    "metrics": true,
    "structured_logs": true,
    "trace_propagation": "w3c",
    "redaction_profile": "celld-v1"
  },
  "retention": {
    "cell_tombstone_days": 30,
    "audit_days": 90,
    "backup_rpo_seconds": 300
  },
  "rollout": {
    "max_unavailable": 1,
    "drain_timeout_seconds": 120,
    "compatible_from": ["v0.2.1"]
  }
}
